{
  "schema_version": "1.0.0",
  "artifact_type": "mechanism_scope_ledger_v1",
  "problem_id": "2023-B",
  "source_mechanism_ids": [
    "MECH-DEPTH", "MECH-SLOPE", "MECH-HEADING", "MECH-SWATH", "MECH-BOUNDARY",
    "MECH-UNCOVERED", "MECH-OVERLAP", "MECH-LENGTH", "MECH-DISCRETIZATION",
    "MECH-INTERPOLATION"
  ],
  "mechanisms": [
    {"mechanism_id":"MECH-DEPTH","name":"船位水深随坡向和位置变化","source_requirement_ids":["REQ-Q1-MODEL","REQ-Q2-MODEL","REQ-Q4-DATA"],"criticality":"core","decision":"modeled","coverage_scope":"full","validity_domain":["Q1-Q3 平面坡面","Q4 官方网格域内"],"unmodeled_aspects":[],"approximation_error_evidence":[],"model_spec_refs":["model_spec.md#坐标与基本几何"],"verification_bindings":["modeling/reference_oracle_registry.json#ORACLE-Q12-RAY"]},
    {"mechanism_id":"MECH-SLOPE","name":"局部坡度对覆盖宽度的影响","source_requirement_ids":["REQ-Q1-MODEL","REQ-Q2-MODEL","REQ-Q4-COVERAGE"],"criticality":"core","decision":"modeled","coverage_scope":"local_approximation","validity_domain":["局部曲率在冻结采样尺度下可忽略","不进行附件范围外外推"],"unmodeled_aspects":["高曲率区域中的非平面声传播"],"approximation_error_evidence":["validation_numerics.yaml#grid_convergence","modeling/route_falsification_plan.json#FALS-Q4-PRIMARY-NUM"],"model_spec_refs":["model_spec.md#q4-决策规格"],"verification_bindings":["modeling/reference_oracle_registry.json#ORACLE-Q4-RECT","modeling/reference_oracle_registry.json#ORACLE-Q4-TRANSLATION"]},
    {"mechanism_id":"MECH-HEADING","name":"航向角决定横向有效坡度","source_requirement_ids":["REQ-Q2-MODEL","REQ-Q3-DESIGN","REQ-Q4-DESIGN"],"criticality":"core","decision":"modeled","coverage_scope":"full","validity_domain":["方向角按冻结坐标约定解释"],"unmodeled_aspects":[],"approximation_error_evidence":[],"model_spec_refs":["model_spec.md#坐标与基本几何"],"verification_bindings":["experiments/2023b_validator_pilot_v2/pilot_result.json"]},
    {"mechanism_id":"MECH-SWATH","name":"边缘波束与海底交点形成覆盖带","source_requirement_ids":["REQ-Q1-MODEL","REQ-Q2-MODEL","REQ-Q3-COVERAGE","REQ-Q4-COVERAGE"],"criticality":"core","decision":"modeled","coverage_scope":"local_approximation","validity_domain":["均匀介质直线传播","冻结换能器开角"],"unmodeled_aspects":["折射声线和设备姿态误差"],"approximation_error_evidence":["modeling/reference_oracle_registry.json#ORACLE-Q12-RAY"],"model_spec_refs":["model_spec.md#坐标与基本几何"],"verification_bindings":["scripts/run_2023b_validator_pilot.py"]},
    {"mechanism_id":"MECH-BOUNDARY","name":"覆盖带与待测海域边界裁剪","source_requirement_ids":["REQ-Q3-COVERAGE","REQ-Q4-COVERAGE"],"criticality":"core","decision":"modeled","coverage_scope":"full","validity_domain":["官方矩形海域边界"],"unmodeled_aspects":[],"approximation_error_evidence":[],"model_spec_refs":["model_spec.md#q3-决策规格","model_spec.md#q4-决策规格"],"verification_bindings":["validator_test_cases/q4_boundary_clip.json"]},
    {"mechanism_id":"MECH-UNCOVERED","name":"覆盖并集补集形成漏测面积","source_requirement_ids":["REQ-Q3-COVERAGE","REQ-Q4-OUTPUT-UNCOVERED"],"criticality":"core","decision":"modeled","coverage_scope":"full","validity_domain":["冻结边界和数值离散"],"unmodeled_aspects":[],"approximation_error_evidence":["validation_numerics.yaml#area_uncertainty_upper_bound"],"model_spec_refs":["model_spec.md#q4-决策规格"],"verification_bindings":["modeling/reference_oracle_registry.json#ORACLE-Q4-RECT"]},
    {"mechanism_id":"MECH-OVERLAP","name":"相邻覆盖带有符号交叠与重叠率","source_requirement_ids":["REQ-Q1-MODEL","REQ-Q3-OVERLAP","REQ-Q4-OVERLAP","REQ-Q4-OUTPUT-OVER20"],"criticality":"core","decision":"modeled","coverage_scope":"full","validity_domain":["相邻测线按冻结顺序比较"],"unmodeled_aspects":[],"approximation_error_evidence":[],"model_spec_refs":["metric_denominator_registry.yaml"],"verification_bindings":["validators/problem_boundary_v2/validate.py","validator_test_cases/q3_illegal_overlap.json"]},
    {"mechanism_id":"MECH-LENGTH","name":"边界裁剪后测线长度求和","source_requirement_ids":["REQ-Q3-SHORTEST","REQ-Q4-SHORTEST","REQ-Q4-OUTPUT-LENGTH"],"criticality":"core","decision":"modeled","coverage_scope":"full","validity_domain":["有限直线段决策向量"],"unmodeled_aspects":["转弯半径和航行调度成本"],"approximation_error_evidence":[],"model_spec_refs":["validator_contract.yaml"],"verification_bindings":["validator_test_cases/q3_rectangle_hand_case.json"]},
    {"mechanism_id":"MECH-DISCRETIZATION","name":"连续覆盖指标的数值离散与收敛","source_requirement_ids":["REQ-Q4-COVERAGE","REQ-Q4-OUTPUT-UNCOVERED","REQ-Q4-OUTPUT-OVER20"],"criticality":"core","decision":"modeled","coverage_scope":"partial","validity_domain":["冻结网格和测线采样收敛阈值内"],"unmodeled_aspects":["低于面积误差上界的漏测细节"],"approximation_error_evidence":["validation_numerics.yaml#grid_convergence","validation_numerics.yaml#line_sampling_convergence"],"model_spec_refs":["validation_numerics.yaml"],"verification_bindings":["modeling/reference_oracle_registry.json#ORACLE-Q4-MESH"]},
    {"mechanism_id":"MECH-INTERPOLATION","name":"规则水深网格的域内插值","source_requirement_ids":["REQ-Q4-DATA","REQ-Q4-DESIGN"],"criticality":"core","decision":"proxied","coverage_scope":"proxy_only","validity_domain":["官方规则网格凸包内"],"unmodeled_aspects":["采样点间真实海底微地形"],"approximation_error_evidence":["validation_numerics.yaml#interpolation_comparison"],"model_spec_refs":["data_contract.yaml#attachment"],"verification_bindings":["modeling/route_falsification_plan.json#FALS-Q4-PRIMARY-MECH"]}
  ]
}
